{
  "$schema": "https://json-schema.org/draft/2020-12/schema",
  "$id": "https://java-source-atlas.dev/schema/source-topic.json",
  "title": "Java Source Atlas Topic Index",
  "type": "object",
  "required": ["schemaVersion", "topicId", "title", "primaryVersion", "sourceRef", "lab", "source", "entryPoints", "evidence"],
  "properties": {
    "schemaVersion": { "type": "integer", "const": 1 },
    "topicId": { "type": "string", "minLength": 1 },
    "title": { "type": "string", "minLength": 1 },
    "primaryVersion": { "type": "string", "minLength": 1 },
    "sourceRef": { "type": "string", "minLength": 1 },
    "designInsight": { "type": "string", "minLength": 1 },
    "focusQuestion": { "type": "string", "minLength": 1 },
    "readingGoal": { "type": "string", "minLength": 1 },
    "recommendedNextTopicId": { "type": "string", "minLength": 1 },
    "recommendedNextReason": { "type": "string", "minLength": 1 },
    "versionComparison": {
      "type": "object",
      "required": ["id", "summary", "supportedVersions", "migrationHint"],
      "properties": {
        "id": { "type": "string", "minLength": 1 },
        "summary": { "type": "string", "minLength": 1 },
        "supportedVersions": {
          "type": "array",
          "minItems": 2,
          "items": { "type": "string", "minLength": 1 },
          "uniqueItems": true
        },
        "migrationHint": { "type": "string", "minLength": 1 }
      }
    },
    "versionMethodMappings": {
      "type": "array",
      "uniqueItems": true,
      "items": {
        "type": "object",
        "required": ["version", "sourceMethod", "targetMethod"],
        "properties": {
          "version": {
            "type": "string",
            "enum": ["17", "21"]
          },
          "sourceMethod": { "type": "string", "minLength": 1 },
          "targetMethod": { "type": ["string", "null"], "minLength": 1 },
          "document": { "type": "string", "minLength": 1 },
          "purpose": { "type": "string", "minLength": 1 },
          "scenario": { "type": "string", "minLength": 1 },
          "variables": {
            "type": "array",
            "minItems": 1,
            "uniqueItems": true,
            "items": { "type": "string", "minLength": 1 }
          }
        }
      }
    },
    "compatibleVersions": {
      "type": "array",
      "items": { "type": "string", "minLength": 1 },
      "uniqueItems": true
    },
    "lab": {
      "type": "object",
      "required": ["module", "mainClass", "sourcePath"],
      "properties": {
        "module": { "type": "string", "minLength": 1 },
        "mainClass": { "type": "string", "minLength": 1 },
        "sourcePath": { "type": "string", "minLength": 1 }
      }
    },
    "source": {
      "type": "object",
      "required": ["repository", "className", "sourcePath"],
      "properties": {
        "repository": { "type": "string", "format": "uri" },
        "className": { "type": "string", "minLength": 1 },
        "sourcePath": { "type": "string", "minLength": 1 }
      }
    },
    "relatedSources": {
      "type": "array",
      "uniqueItems": true,
      "items": {
        "type": "object",
        "required": ["className", "sourcePath"],
        "properties": {
          "className": { "type": "string", "minLength": 1 },
          "sourcePath": { "type": "string", "minLength": 1 }
        }
      }
    },
    "entryPoints": {
      "type": "array",
      "minItems": 1,
      "uniqueItems": true,
      "items": {
        "type": "object",
        "required": ["method", "document", "purpose"],
        "properties": {
          "method": { "type": "string", "minLength": 1 },
          "document": { "type": "string", "minLength": 1 },
          "purpose": { "type": "string", "minLength": 1 },
          "sourceClass": { "type": ["string", "null"], "minLength": 1 },
          "summary": { "type": "string", "minLength": 1 },
          "process": {
            "type": "array",
            "minItems": 1,
            "items": { "type": "string", "minLength": 1 }
          },
          "designInsights": {
            "type": "array",
            "minItems": 1,
            "items": { "type": "string", "minLength": 1 }
          },
          "pitfalls": {
            "type": "array",
            "minItems": 1,
            "items": { "type": "string", "minLength": 1 }
          },
          "relatedMethods": {
            "type": "array",
            "minItems": 1,
            "items": {
              "type": "object",
              "required": ["method", "relation", "reason"],
              "properties": {
                "method": { "type": "string", "minLength": 1 },
                "relation": { "type": "string", "minLength": 1 },
                "reason": { "type": "string", "minLength": 1 },
                "sourceClass": { "type": ["string", "null"], "minLength": 1 }
              }
            }
          }
        }
      }
    },
    "evidence": {
      "type": "array",
      "minItems": 3,
      "uniqueItems": true,
      "items": {
        "type": "object",
        "required": ["id", "kind", "claim", "entryPoint", "document", "labMethod", "testClass", "testMethod", "expectedOutcome"],
        "properties": {
          "id": { "type": "string", "minLength": 1 },
          "kind": {
            "type": "string",
            "enum": ["main", "boundary", "failure", "cleanup", "concurrency", "version"]
          },
          "claim": { "type": "string", "minLength": 1 },
          "entryPoint": { "type": "string", "minLength": 1 },
          "document": { "type": "string", "minLength": 1 },
          "labMethod": { "type": "string", "minLength": 1 },
          "testClass": { "type": "string", "minLength": 1 },
          "testMethod": { "type": "string", "minLength": 1 },
          "expectedOutcome": { "type": "string", "minLength": 1 }
        }
      }
    },
    "breakpoints": {
      "type": "array",
      "minItems": 1,
      "uniqueItems": true,
      "items": {
        "type": "object",
        "required": ["method", "scenario", "variables"],
        "properties": {
          "method": { "type": "string", "minLength": 1 },
          "scenario": { "type": "string", "minLength": 1 },
          "sourceClass": { "type": ["string", "null"], "minLength": 1 },
          "evidenceId": { "type": "string", "minLength": 1 },
          "variables": {
            "type": "array",
            "minItems": 1,
            "uniqueItems": true,
            "items": { "type": "string", "minLength": 1 }
          }
        }
      }
    }
  }
}
