{
  "$schema": "../schema.json",
  "schemaVersion": 1,
  "topicId": "openjdk8-jmm-volatile-final",
  "title": "JMM、volatile、final 与 VarHandle 内存语义",
  "primaryVersion": "OpenJDK 8u",
  "sourceRef": "jdk8u412-b08",
  "designInsight": "JMM 不规定某台机器的缓存实现，而是用 happens-before 和发布规则把并发程序允许观察到的结果约束成可推理的契约。",
  "focusQuestion": "为什么 volatile 能保证可见性和顺序，却不能让 count++ 这样的复合操作原子？",
  "readingGoal": "能画出 start、join、volatile、final 和 monitor 的 happens-before 边界，并识别仍存在的数据竞争。",
  "recommendedNextTopicId": "openjdk8-synchronized-objectmonitor",
  "recommendedNextReason": "把内存模型中的 monitor 语义落到字节码、重入和 wait-notify 的具体执行路径。",
  "lab": {
    "module": "labs/jdk-labs",
    "mainClass": "io.github.javasourceatlas.jdk.concurrent.JmmVolatileDebugLab",
    "sourcePath": "labs/jdk-labs/src/main/java/io/github/javasourceatlas/jdk/concurrent/JmmVolatileDebugLab.java"
  },
  "compatibleVersions": [
    "OpenJDK 17",
    "OpenJDK 21"
  ],
  "source": {
    "repository": "https://github.com/openjdk/jdk8u",
    "className": "java.lang.Thread",
    "sourcePath": "jdk/src/share/classes/java/lang/Thread.java"
  },
  "relatedSources": [
    {
      "className": "java.util.concurrent.atomic.AtomicInteger",
      "sourcePath": "jdk/src/share/classes/java/util/concurrent/atomic/AtomicInteger.java"
    },
    {
      "className": "java.util.concurrent.FutureTask",
      "sourcePath": "jdk/src/share/classes/java/util/concurrent/FutureTask.java"
    },
    {
      "className": "java.util.concurrent.CopyOnWriteArrayList",
      "sourcePath": "jdk/src/share/classes/java/util/concurrent/CopyOnWriteArrayList.java"
    },
    {
      "className": "sun.misc.Unsafe",
      "sourcePath": "jdk/src/share/classes/sun/misc/Unsafe.java"
    }
  ],
  "entryPoints": [
    {
      "method": "Thread.start()",
      "document": "/jdk/concurrent/jmm/happens-before#start-与-join-是两条方向相反的边",
      "purpose": "把调用 start 之前的动作发布给被启动线程中的全部动作"
    },
    {
      "method": "Thread.join(long)",
      "document": "/jdk/concurrent/jmm/happens-before#start-与-join-是两条方向相反的边",
      "purpose": "在检测到目标线程终止后读取其终止前发布的普通结果"
    },
    {
      "method": "AtomicInteger.compareAndSet(int,int)",
      "document": "/jdk/concurrent/jmm/volatile-final#volatile-的精确能力",
      "purpose": "对比 volatile 单次访问与 CAS 读改写的原子性边界",
      "sourceClass": "java.util.concurrent.atomic.AtomicInteger"
    },
    {
      "method": "FutureTask.set(V)",
      "document": "/jdk/concurrent/jmm/volatile-final#volatile-引用发布的是之前的状态",
      "purpose": "观察普通 outcome 如何先写入，再通过 volatile state 终态发布",
      "sourceClass": "java.util.concurrent.FutureTask"
    },
    {
      "method": "CopyOnWriteArrayList.setArray(Object[])",
      "document": "/jdk/concurrent/jmm/volatile-final#volatile-引用发布的是之前的状态",
      "purpose": "观察 volatile 数组引用如何发布整份构造完成的新快照",
      "sourceClass": "java.util.concurrent.CopyOnWriteArrayList"
    },
    {
      "method": "Unsafe.putOrderedObject(Object,long,Object)",
      "document": "/jdk/concurrent/jmm/varhandle-version#jdk-8-为什么大量出现-unsafe",
      "purpose": "定位 JDK 8 release 风格 ordered 写的内部 VM 边界",
      "sourceClass": "sun.misc.Unsafe"
    }
  ],
  "evidence": [
    {
      "id": "volatile-publication-main",
      "kind": "main",
      "claim": "先写普通 payload 再写 volatile 标志，可以把 payload 发布给观察到标志的读取线程。",
      "entryPoint": "Thread.start()",
      "document": "/jdk/concurrent/jmm/happens-before#start-与-join-是两条方向相反的边",
      "labMethod": "observeVolatilePublication",
      "testClass": "io.github.javasourceatlas.jdk.concurrent.JmmVolatileBehaviorTest",
      "testMethod": "shouldPublishPlainPayloadThroughVolatileFlag",
      "expectedOutcome": "读取线程看到 ready=true 后同时看到发布线程此前写入的完整 payload。"
    },
    {
      "id": "volatile-lost-update-concurrency",
      "kind": "concurrency",
      "claim": "volatile 只能保证单次读写可见，两个线程的 read-modify-write 仍会覆盖彼此结果。",
      "entryPoint": "AtomicInteger.compareAndSet(int,int)",
      "document": "/jdk/concurrent/jmm/volatile-final#volatile-的精确能力",
      "labMethod": "observeControlledLostUpdate",
      "testClass": "io.github.javasourceatlas.jdk.concurrent.JmmVolatileBehaviorTest",
      "testMethod": "shouldShowVolatileIncrementIsNotAtomic",
      "expectedOutcome": "受控时序让两个线程读取同一个旧值并依次写回，最终计数少一次；CAS 对照值正确。"
    },
    {
      "id": "final-publication-boundary",
      "kind": "boundary",
      "claim": "构造完成的 final 字段经安全发布后可以作为不可变快照读取。",
      "entryPoint": "Thread.start()",
      "document": "/jdk/concurrent/jmm/happens-before#start-与-join-是两条方向相反的边",
      "labMethod": "observeFinalSnapshot",
      "testClass": "io.github.javasourceatlas.jdk.concurrent.JmmVolatileBehaviorTest",
      "testMethod": "shouldReadFinalStateAfterSafePublication",
      "expectedOutcome": "读取线程观察到对象后，所有 final 字段均为构造器写入值且保持一致。"
    }
  ],
  "breakpoints": [
    {
      "method": "JmmVolatileDebugLab.observeVolatilePublication()",
      "scenario": "先写普通 payload，再写 volatile ready，读取方观察到 ready 后读取 payload",
      "variables": [
        "state.payload",
        "state.ready",
        "observedPayload"
      ]
    },
    {
      "method": "JmmVolatileDebugLab.observeControlledLostUpdate()",
      "scenario": "两个线程在写回前读取相同 volatile 旧值，稳定复现丢失更新",
      "variables": [
        "counter.value",
        "snapshotsRead",
        "writeBack",
        "snapshot"
      ]
    },
    {
      "method": "JmmVolatileDebugLab.observeStartAndJoinBoundaries()",
      "scenario": "在 start 前写配置，在线程内写结果，并在 join 返回后读取",
      "variables": [
        "configuration",
        "result",
        "worker.getState()"
      ]
    },
    {
      "method": "JmmVolatileDebugLab.observeFinalSnapshot()",
      "scenario": "构造不可变对象后通过 Thread.start 安全发布",
      "variables": [
        "snapshot.name",
        "snapshot.value",
        "observed"
      ]
    },
    {
      "method": "JmmVolatileDebugLab.observeVarHandleAvailability()",
      "scenario": "分别在 Java 8 与 Java 17 运行同一 Lab，观察 VarHandle API 可用性",
      "variables": [
        "java.specification.version",
        "available"
      ]
    },
    {
      "method": "Thread.start()",
      "scenario": "运行 volatile 发布测试，观察工作线程建立 start happens-before 边界",
      "variables": [
        "this",
        "threadStatus",
        "state.ready",
        "state.payload"
      ],
      "evidenceId": "volatile-publication-main"
    }
  ]
}
