{
  "$schema": "../schema.json",
  "schemaVersion": 1,
  "topicId": "openjdk8-java-util-concurrent-futuretask",
  "title": "OpenJDK 8 FutureTask 源码解析",
  "primaryVersion": "OpenJDK 8u",
  "sourceRef": "jdk8u412-b08",
  "designInsight": "它用一个状态机把 Runnable 执行权、结果发布、等待者 Treiber 栈和取消中断连接起来，让执行器与调用者共享同一对象。",
  "focusQuestion": "cancel(true) 成功为什么不代表任务代码已经停止，INTERRUPTING 又为什么必须过渡到 INTERRUPTED？",
  "readingGoal": "能画出正常、异常和取消三条终态路径，并指出 get 如何注册等待节点、park 和被唤醒。",
  "recommendedNextTopicId": "openjdk8-java-util-concurrent-scheduledthreadpoolexecutor",
  "recommendedNextReason": "观察周期任务如何复用 FutureTask 的 runAndReset，在每轮成功后重新进入延迟队列。",
  "versionComparison": {
    "id": "future-task",
    "summary": "FutureTask 的七状态、runner 执行权和 WaitNode 完成协议保持稳定；JDK 17 用 VarHandle 和更稳健的定时等待替代 Unsafe 路径，JDK 21 再增加非阻塞状态、结果和异常查询。",
    "supportedVersions": [
      "8",
      "17",
      "21"
    ],
    "migrationHint": "跨版本调试先区分私有 int state 与 JDK 21 Future.State；Java 8/17 代码不能直接调用 resultNow、exceptionNow 和 state。"
  },
  "lab": {
    "module": "labs/jdk-labs",
    "mainClass": "io.github.javasourceatlas.jdk.concurrent.FutureTaskDebugLab",
    "sourcePath": "labs/jdk-labs/src/main/java/io/github/javasourceatlas/jdk/concurrent/FutureTaskDebugLab.java"
  },
  "compatibleVersions": [
    "OpenJDK 17",
    "OpenJDK 21"
  ],
  "source": {
    "repository": "https://github.com/openjdk/jdk8u",
    "className": "java.util.concurrent.FutureTask",
    "sourcePath": "jdk/src/share/classes/java/util/concurrent/FutureTask.java"
  },
  "relatedSources": [
    {
      "className": "java.util.concurrent.Future",
      "sourcePath": "jdk/src/share/classes/java/util/concurrent/Future.java"
    },
    {
      "className": "java.util.concurrent.RunnableFuture",
      "sourcePath": "jdk/src/share/classes/java/util/concurrent/RunnableFuture.java"
    },
    {
      "className": "java.util.concurrent.AbstractExecutorService",
      "sourcePath": "jdk/src/share/classes/java/util/concurrent/AbstractExecutorService.java"
    },
    {
      "className": "java.util.concurrent.ScheduledThreadPoolExecutor",
      "sourcePath": "jdk/src/share/classes/java/util/concurrent/ScheduledThreadPoolExecutor.java"
    }
  ],
  "entryPoints": [
    {
      "method": "run()",
      "document": "/jdk/concurrent/futuretask/state-machine#run-如何只让一个线程执行-callable",
      "purpose": "通过 runner CAS 取得一次执行权并发布正常或异常结果"
    },
    {
      "method": "set(V)",
      "document": "/jdk/concurrent/futuretask/state-machine#set-和-setexception-的两阶段发布",
      "purpose": "以 COMPLETING 中间态写入正常 outcome 并发布 NORMAL"
    },
    {
      "method": "setException(Throwable)",
      "document": "/jdk/concurrent/futuretask/state-machine#set-和-setexception-的两阶段发布",
      "purpose": "保存 Callable 抛出的异常并发布 EXCEPTIONAL"
    },
    {
      "method": "get()",
      "document": "/jdk/concurrent/futuretask/waiters-cancel#get-先读-state-再决定是否等待",
      "purpose": "等待终态并按正常、异常或取消语义报告结果"
    },
    {
      "method": "awaitDone(boolean,long)",
      "document": "/jdk/concurrent/futuretask/waiters-cancel#awaitdone-的完整循环",
      "purpose": "注册 WaitNode，并处理中断、超时、park 和终态重检"
    },
    {
      "method": "finishCompletion()",
      "document": "/jdk/concurrent/futuretask/waiters-cancel#finishcompletion-如何逐个唤醒等待者",
      "purpose": "摘除等待栈、逐个 unpark、调用 done 并清理 callable"
    },
    {
      "method": "removeWaiter(WaitNode)",
      "document": "/jdk/concurrent/futuretask/waiters-cancel#removewaiter-如何清理退出节点",
      "purpose": "清理因中断或超时退出的等待节点"
    },
    {
      "method": "cancel(boolean)",
      "document": "/jdk/concurrent/futuretask/waiters-cancel#cancel-false-和-cancel-true-的准确边界",
      "purpose": "区分直接取消与尝试中断 runner 的两条状态路径"
    },
    {
      "method": "handlePossibleCancellationInterrupt(int)",
      "document": "/jdk/concurrent/futuretask/waiters-cancel#handlepossiblecancellationinterrupt-防止什么",
      "purpose": "等待 INTERRUPTING 结束，关闭迟到中断泄漏窗口"
    },
    {
      "method": "done()",
      "document": "/jdk/concurrent/futuretask/state-machine#done-钩子的时序与约束",
      "purpose": "在终态发布和等待者唤醒后执行子类完成回调"
    },
    {
      "method": "runAndReset()",
      "document": "/jdk/concurrent/futuretask/state-machine#runandreset-为何成功后仍是-new",
      "purpose": "运行 Callable 但不发布正常结果，为周期任务保留 NEW 状态"
    }
  ],
  "evidence": [
    {
      "id": "single-run-main",
      "kind": "main",
      "claim": "FutureTask 用 runner CAS 和 NEW 状态检查保证 Callable 最多执行一次。",
      "entryPoint": "run()",
      "document": "/jdk/concurrent/futuretask/state-machine#run-如何只让一个线程执行-callable",
      "labMethod": "observeSingleExecution",
      "testClass": "io.github.javasourceatlas.jdk.concurrent.FutureTaskBehaviorTest",
      "testMethod": "shouldRunCallableOnlyOnce",
      "expectedOutcome": "两个线程竞争调用 run 后 Callable 计数仍为一，get 返回唯一结果。"
    },
    {
      "id": "exception-terminal-failure",
      "kind": "failure",
      "claim": "Callable 抛出的异常经 setException 发布为 EXCEPTIONAL 终态，get 用 ExecutionException 暴露原因。",
      "entryPoint": "setException(Throwable)",
      "document": "/jdk/concurrent/futuretask/state-machine#set-和-setexception-的两阶段发布",
      "labMethod": "observeExceptionalCompletion",
      "testClass": "io.github.javasourceatlas.jdk.concurrent.FutureTaskBehaviorTest",
      "testMethod": "shouldReportExceptionalCompletion",
      "expectedOutcome": "任务进入完成态，get 抛 ExecutionException 且 cause 是原始业务异常。"
    },
    {
      "id": "interrupted-waiter-cleanup",
      "kind": "cleanup",
      "claim": "等待 get 的线程被中断后会从 Treiber waiter 栈中移除，而任务本身仍保持 NEW。",
      "entryPoint": "removeWaiter(WaitNode)",
      "document": "/jdk/concurrent/futuretask/waiters-cancel#removewaiter-如何清理退出节点",
      "labMethod": "observeInterruptedWaiter",
      "testClass": "io.github.javasourceatlas.jdk.concurrent.FutureTaskBehaviorTest",
      "testMethod": "shouldRemoveInterruptedGetWaiterWithoutCompletingTask",
      "expectedOutcome": "等待线程收到 InterruptedException，任务未完成且随后仍可正常运行并返回结果。"
    }
  ],
  "breakpoints": [
    {
      "method": "run()",
      "scenario": "两个线程同时调用 run，观察一次执行权和取消二次检查",
      "variables": [
        "state",
        "runner",
        "c",
        "ran",
        "result"
      ],
      "evidenceId": "single-run-main"
    },
    {
      "method": "set(V)",
      "scenario": "跟踪正常结果的两阶段发布",
      "variables": [
        "state",
        "outcome",
        "v",
        "waiters"
      ]
    },
    {
      "method": "setException(Throwable)",
      "scenario": "让 Callable 抛异常并观察异常结果发布",
      "variables": [
        "state",
        "outcome",
        "t"
      ],
      "evidenceId": "exception-terminal-failure"
    },
    {
      "method": "awaitDone(boolean,long)",
      "scenario": "两个 get 等待者分别创建节点并 park",
      "variables": [
        "timed",
        "nanos",
        "q",
        "queued",
        "state",
        "waiters"
      ]
    },
    {
      "method": "finishCompletion()",
      "scenario": "正常完成或取消后摘除整栈并逐个唤醒等待者",
      "variables": [
        "q",
        "q.thread",
        "q.next",
        "waiters"
      ]
    },
    {
      "method": "removeWaiter(WaitNode)",
      "scenario": "定时 get 超时后清理失效节点",
      "variables": [
        "node",
        "pred",
        "q",
        "s",
        "waiters"
      ],
      "evidenceId": "interrupted-waiter-cleanup"
    },
    {
      "method": "cancel(boolean)",
      "scenario": "比较 cancel false 与 cancel true 对运行中任务的影响",
      "variables": [
        "mayInterruptIfRunning",
        "state",
        "runner",
        "t"
      ]
    },
    {
      "method": "runAndReset()",
      "scenario": "周期式运行成功后保留 NEW，并在异常或取消时结束",
      "variables": [
        "state",
        "runner",
        "ran",
        "s"
      ]
    }
  ]
}
